"Title","Company","Location","Salary","Summary","Link"
"","","","","We are looking for a passionate Software Engineer to design, develop and install software solutions. Software Engineer responsibilities include gathering user requirements, defining system functionality and writing code in various languages, like Java, Ruby on Rails, Python, SQL or .NET programming languages (e.g. C++ or JScript.NET.). Our ideal candidates are familiar with the software development life cycle (SDLC) from preliminary system analysis to tests and deployment. Ultimately, the role of the Software Engineer is to build high-quality, innovative, and fully performing software that complies with coding standards and technical design. Responsibilities Execute full software development life cycle (SDLC) Develop flowcharts, layouts, and documentation to identify requirements and solutions Write well-designed, testable code Produce specifications and determine operational feasibility Integrate software components into a fully functional software system Develop software verification plans and quality assurance procedures Document and maintain software functionality Troubleshoot, debug and upgrade existing systems Deploy programs and evaluate user feedback Comply with project plans and industry standards Ensure software is updated with latest features Skills Proven work experience as a Software Engineer or Software Developer Experience designing interactive applications Ability to develop software in Java, Ruby on Rails, C++, or other programming languages Excellent knowledge of relational databases, SQL and ORM technologies (JPA2, Hibernate) Experience developing web applications using at least one popular web framework (JSF, Wicket, GWT, Spring MVC) Applicants must be authorized to work for ANY employer in the U.S. We are unable to sponsor or take over sponsorship of an employment Visa at this time. Experience with test-driven development Proficiency in software engineering tools Ability to document requirements and specifications BSc degree in Computer Science, Engineering or relevant field Job Type: Full-time Applicants must be authorized to work for ANY employer in the U.S. We are unable to sponsor or take over sponsorship of an employment Visa at this time. Job Type: Full-time Pay: $53,112.42 - $110,820.08 per year Benefits: 401(k) 401(k) matching Dental insurance Health insurance Health savings account Life insurance Paid time off Vision insurance Schedule: Monday to Friday Education: Bachelor's (Required) Ability to Commute: Mission, KS 66202 (Required) Work Location: In person","https://www.indeed.com/rc/clk?jk=7288056b1daadead&bb=3O82POBeUphUY5u-tecTQhBCg1Z4xy-bn9RmjvjSu8DUSLoYDgbJQ5zKPE0yj0arpdlapDdvhhQ3TtkrWmlgPYGyQkhec_gtoWpjt6uw_4V1QDG4RGJml7SbqQogxhnedj3w6hefIE17bNqYwAg1sg%3D%3D&xkcb=SoCc67M3uH6hX_XzUR0NbzkdCdPP&fccid=0b9050390842f1c8&cmp=Spark-Change%2C-LLC&ti=Software+Engineer&vjs=3"
"","","","","Company Description  AG Technologies was founded as a software solutions company in 2008 & has its corporate headquarters at Chesterfield, Missouri with branches within the US and India. Over the years the organization has expanded into various market segments & activities including 'Consultancy services' of technical personnel in large and multi-national organizations. Over the last five years, our client base of Fortune 100 companies has expanded dramatically  Job Description  Skills :C++,SQL,Oracle  Qualifications  Master of Computer Science /MIS/ECE/EE  Additional Information  Further Information please contact to 214-295-4212","https://www.indeed.com/rc/clk?jk=44a2a7e70ff46aac&bb=3O82POBeUphUY5u-tecTQpYhTLic3z8Ectbbqd3nO1NO3CH8eTejewbleCUpNdgFou3XdtJaBCo88lOPiY04ig_ke7x5wdcEKG3MR1ylRr4pUuEjVght-Kqi00RLOwRQ5yx9TiljlN6sG2u54CCDzw%3D%3D&xkcb=SoAo67M3uH6hX_XzUR0MbzkdCdPP&fccid=3d8f40897a299d79&vjs=3"
"","","","","Digital Foundry has been a pioneer in digital innovation for over 25 years. We specialize in partnering with Fortune 500 companies to plan, design, and build cutting-edge digital products. Our portfolio includes custom mobile apps, responsive websites, Web 3.0 interactions, user experiences, connected hardware, IoT solutions, and comprehensive platforms that enhance both customer-facing products and internal operations tools.  We are currently seeking a Software Engineer Associate to join our technology group in creating cutting-edge software solutions for our clients. Key Responsibilities: Work in a collaborative, team-centric environment utilizing agile principles Deliver high-quality solutions across multiple industries Collaborate with team to build software solutions where the problem is often ill defined Work on a variety of projects ranging in both size and scope Test your code and review the code of others Receive mentorship and accelerated learning Learn and adapt to new, complex development environments Minimum Requirements: BS in Computer Science OR relevant work experience Proficiency in one or more of the following: C#, Java, Javascript, Golang, Python, and CSS Work authorization in the U.S. which does not require sponsorship by the employer for a visa. Why Join Us? Competitive Compensation: Digital Foundry offers a comprehensive compensation and benefits package, including a competitive salary, performance bonuses, medical, dental, and vision benefits, and a matching 401(k) retirement program. Work-Life Balance: Enjoy up to three weeks of time off in your first year, along with a supportive work environment. Innovative Culture: Our team comprises diverse, intelligent, and fun individuals who are passionate about pushing the boundaries of innovation. Compensation Compensation at Digital Foundry varies based on factors such as location, role, skill, and experience. In compliance with California law, Digital Foundry provides a reasonable target base salary range of $75k - $83k. Location: Our office is located in Tiburon CA, a short drive or ferry ride from San Francisco. We are looking for candidates willing to work full-time from the office.  Thank you for your interest in Digital Foundry. We look forward to hearing from you! Digital Foundry, Inc. is an equal opportunity employer that is dedicated to a policy of non discrimination in employment and does not discriminate in hiring or employment on the basis of race, religion, creed, color, sex, sexual orientation, age, national origin, ancestry, mental or physical handicap, disability, or veteran status. gez6oyAPTZ","https://www.indeed.com/rc/clk?jk=487617308570f6f2&bb=3O82POBeUphUY5u-tecTQhcBOZq_ymm0V5Zt_h5CaoGjKlQa2J4nav-gBry3p1a1GSftqVmcHXbUWk4s4KlEX_-ypL9vH_TlZt-hqj1_059b86y_AyzutAcIPR9aWnPHCiZpJxJ_lQzwvVhtttRJCA%3D%3D&xkcb=SoDB67M3uH6hX_XzUR0DbzkdCdPP&fccid=81d6feff86debee6&vjs=3"
"","","","","ETC, a global leader in the rigging, entertainment, and architectural lighting industry is growing! We are looking for Software Engineers to join our R&D team. If you have a Technical Bachelor's degree preferably in Computer Science or Computer Engineering, a passion for creativity, and to work on the most cutting edge technologies then ETC is the place for you! Check out ETC's amazing benefits that come with joining the team: Casual work environment that lets you dress comfortably everyday Health benefits and PTO starting on day one Retirement plans, including 401k, Roth, Employee Stock Ownership Program (100% employee owned) Get rewarded with Quarterly Bonuses! Apply with ETC and come have fun and money with us!","https://www.indeed.com/rc/clk?jk=ee2de57d4d2ec67b&bb=3O82POBeUphUY5u-tecTQnYqES2bvgziHiqRD6z6Txw6PTD6fDyHfGoz0AtWS8YD-w5vr7CiJKyYof_eTcX_h0INkKBIBCx64dxpegXda3-ra8VhR3pG-EQ6Q_TeNa9a8PbUGrYONq5VhzJD9_7ZPQ%3D%3D&xkcb=SoB167M3uH6hX_XzUR0CbzkdCdPP&fccid=6b7cfd09722d2164&vjs=3"
"","","","","Who We Are Metrix is the preferred supplier of industrial condition monitoring systems to many of the world’s leading manufacturers and users of cooling towers, gas turbines, reciprocating compressors, and other rotating and reciprocating machinery. With headquarters in Houston, Texas, we operate in more than 40 countries via factory-direct sales and service professionals, along with a strategic network of instrumentation partners. We pioneered the concept of simple, affordable machinery protection with our seismic measurement technology. Initially focused on geophysical exploration, this technology also found abundant applications for vibration measurements on industrial machines and has been our focus for 50 years. Your Role The Software Engineer is part of the Houston based Engineering team, responsible for a combination of sustaining activities and engineering projects, including new product development. The Software Engineer will be responsible for a variety of engineering initiatives in designing, planning, and testing of software for company produced systems. The engineer may assist with customer and in-house training and project coordination, as well as periodic support for other Software Engineers within the group. The position will also focus on software support and projects for our new China operations, which will require occasional off hour meetings. Hybrid work from office and schedule will provide flexibility for China off hour support. Responsibilities: Designing, coding, and testing software applications based on user requirements. Collaborating with cross-functional teams to analyze and understand software requirements. Developing high-quality, efficient, and scalable code using programming languages and frameworks. Troubleshooting and debugging software issues and providing timely resolutions. Conducting system and software performance testing and making recommendations for improvements. Participating in code reviews to ensure adherence to coding standards and best practices. Maintaining and enhancing existing software systems. Keeping up to date with emerging technologies and industry trends to drive innovation. Review, develop, and prepare project documentation following standards, practices, and use of engineering tools as recommended by governing department. Qualifications: Education & Experience: Bachelor's degree in computer science, software engineering, or a related field (or equivalent work experience). Three (3) years of Software Engineering required. Proficiency in one or more programming languages (such as C#, C++, Python, etc.). Familiarity with software development methodologies (such as Agile, Scrum, etc.). Experience with software development tools and frameworks (such as Git, IDEs, etc.). Competencies: Strong problem-solving and analytical skills. Excellent communication and teamwork abilities. Attention to detail and a commitment to producing high-quality work. ______________________________________________________________________________  We offer a generous compensation package that offers: Competitive salary 401(k) Health, vision, and dental insurance Health Savings Accounts Employee Assistance Program Educational Reimbursement Competitive paid time off program  Privacy We are committed to the protection and promotion of your privacy. In connection with your application for employment with us at Metrix, please click on this link to view our Applicant Privacy Notice. (metrixvibration.com)  Metrix is an Equal Opportunity Employer. Employment decisions are made without regard to race, color, religion, national or ethnic origin, sex, sexual orientation, gender identity or expression, age, disability, protected veteran status or other characteristics protected by law. Equal Opportunity Employer/Protected Veterans/Individuals with Disabilities This employer is required to notify all applicants of their rights pursuant to federal employment laws. For further information, please review the Know Your Rights notice from the Department of Labor.","https://www.indeed.com/rc/clk?jk=2441cd4c4784900d&bb=3O82POBeUphUY5u-tecTQlZRQLMO3ciQz6ho-rMBLly7x3rfCrT9MQKYxMJw1ezYIKrsK6C8B0XshkdmR2d2mWEGj4VnqeYxziPEijUyfu_EMchW6uCORtGf3cTihsZjY8TeDufYB-PTFGrCnhtx2Q%3D%3D&xkcb=SoDo67M3uH6hX_XzUR0BbzkdCdPP&fccid=61c3eb6ca313243b&vjs=3"
"","","","","Software Engineer @ Anatomy Financial Anatomy is on a mission to automate financial operations for healthcare and enable providers to focus on quality patient care. Financial operations in healthcare are unique. Anatomy uses the latest advancements in AI and fintech to create seamless solutions purpose-built for healthcare organizations. Anatomy is a fast-growing, venture-backed business based in the Bay Area and backed by leading investors including Lightspeed, Canapi, Meridian Street Capital, and Live Oak Bank. The Role As an ambitious member of a growing team, you will play an important role in shaping the product as we build Anatomy. We are looking for a highly intelligent, humble, curious, and detail oriented person who loves solving problems with code. We are looking for an engineer excited about a wide range of work dealing with technical problems across the breadth of our backend services and infrastructure. What You’ll Do Write clean, maintainable, and scalable code. Contribute to the system design of new product features. Contribute to the architecture and design of the product. Help develop a strong engineering culture and high quality development and testing practices. Contribute to the definition, implementation, and evolution of the technical architecture. Experience and Attributes you’ll bring Must love coding and solving problems with code. Elegant design of systems, data structures, and software. Expertise in Python. Your code reflects the Zen of Python. Demonstrated success at building distributed systems that are scalable, easy to understand, and maintainable Bonus: Expertise in healthcare or fintech. Bonus: Infrastructure experience with AWS or GCP Bonus: Expertise with Terraform and IaaC Bonus: Expertise with NLP, Machine Learning, LLM Anatomy Financial strives to create a safe, inclusive, and rewarding environment. We are committed to building diverse teams and strongly encourage people from underrepresented groups, including but not limited to women, people of color, LGBTQIA+ individuals, people with disabilities, members of ethnic minorities, foreign-born residents, and veterans to apply. Anatomy is an equal opportunity employer. Applicants will not be discriminated against because of race, color, creed, sex, sexual orientation, gender identity, gender expression, age, religion, national origin, citizenship status, disability, ancestry, marital status, veteran status, medical condition or any protected category prohibited by local, state or federal laws.","https://www.indeed.com/rc/clk?jk=a092e0290cfe09fa&bb=3O82POBeUphUY5u-tecTQty6bINjwK3ejeiVFIjRv1RJhLgsqPYC4lCUBR6IYBy19zFpWJa6eE6YNhdxTe42b2J90kcrSxRRsViZPvyESXP9qTt6hAHHMzLCPfXqtj0eU_LgV8rQGGRckfHzbuQ7Rg%3D%3D&xkcb=SoBc67M3uH6hX_XzUR0AbzkdCdPP&fccid=dd616958bd9ddc12&vjs=3"
"","","","","Be a part of the future of autonomous robots! In this software engineering role, you'll be on the front lines building software for a fully autonomous robot, guided by a team of expert software engineers and roboticists from Waymo, Google, Carnegie Mellon, Princeton, and top robotics startups. Responsibilities: Perception: design and build algorithms to let the robot see and understand its surroundings, using the latest sensors and advancements from self-driving cars. Motion planning: design and build robust decision making systems to let the robot pick up and wield tools. Infrastructure: design and build tooling to allow human-robot interactions, remote monitoring, and data management. Requirements: Exceptional software engineering capabilities, especially in Python and C++. Robotics experience is a plus, but not required, as you'll work directly with expert roboticists in this role. The desire to work hard, have fun, and grow your career in the field of autonomous robots! About the company: Altitude AI creates autonomous workstations that can pick up and use tools naturally. These workstations automate the company’s first vertical, food manufacturing, without requiring changes to the current manufacturing environment. Altitude AI is founded by a former Waymo engineer and Princeton CS alum, now on his fourth robot platform.","https://www.indeed.com/rc/clk?jk=5ed5e99c37378261&bb=3O82POBeUphUY5u-tecTQk3Q3HIt-vG59hAUgqhwBgY-stxi7CXeWphQTwSn2arGSBsICgxNzYCW4NsOXanQQsOiYrnC-MhVMqUloz9ArvKLnwUo_NQR_ThzMub9qprzTB3rqqWT0euD5PjWLkEQpA%3D%3D&xkcb=SoDS67M3uH6hX_XzUR0HbzkdCdPP&fccid=dd616958bd9ddc12&vjs=3"
"","","","","Software Engineer At Aletheia Digital, we are guided by three core tenets: Make it Work For The Client, Provide Exceptional Customer Service, & Form Authentic Relationships. We are grounded in an “others first” mindset. That means we are driven to deliver results for our team members and clients; we serve others the way they want to be served; and we invest in building connections through relationship each and every day. We are deeply influenced by the entrepreneurial spirit. Our team members are problem solvers by nature, looking for solutions and new ideas rather than having those solutions and ideas given to them. We learn from each other, challenge each other, and celebrate each other when we succeed. As a Software Engineer with Aletheia Digital, you will embody this philosophy by continuing to develop and maintain software applications and partnering with your team members to ensure the work we do meets and exceeds expectations. As a Software Engineer, the key responsibilities you’ll engage in daily are: KEY RESPONSIBILITIES Developing new software applications on both the front and back ends Maintaining, optimizing, and improving current software applications System and Software documentation Other duties as assigned As a Software Engineer, the desired or required experience we are looking for are: EDUCATION / EXPERIENCE Bachelor's degree or equivalent in Computer Science or related fields 3 years of Software Engineer experience preferred Coding Languages: JavaScript, HTML, CSS, and others Platforms: Google Cloud Platform, Amazon Web Services Lightsail / EC2, Duda, Supabase, GitHub Skills: APIs, Webhooks, UX and UI, Software Packages Exceptional people skills with a positive and cheerful disposition Must be extremely resourceful and able to make sound recommendations based on research and experience Must be a self-starter who sets priorities, approaches new tasks with positivity and strives to execute with a high level of self-confidence, accountability, poise, maturity and interpersonal skills Must be able to manage the demands of completing multiple tasks under deadline Must be a team player who is passionate about their contribution towards delivering great work At Aletheia Digital, we know our first customer is YOU! That is why we provide benefits that go beyond your paycheck. Creating a work environment that helps you maximize your potential is our commitment to our team members. To that end, as a Software Engineer with Aletheia Digital, you can expect the following additional benefits with your employment: BENEFITS Health Insurance Dental Insurance Vision Insurance Paid Time Off 401(k) Life Insurance Disability Insurance Job Type: Full-time Benefits: 401(k) Dental insurance Health insurance Life insurance Paid time off Vision insurance Schedule: 8 hour shift Monday to Friday Work Location: In person Columbus, GA Job Type: Full-time Pay: $80,000.00 - $100,000.00 per year Benefits: 401(k) AD&D insurance Dental insurance Disability insurance Health insurance Life insurance Paid holidays Paid time off Vision insurance Schedule: 8 hour shift Monday to Friday Work Location: In person","https://www.indeed.com/rc/clk?jk=340c549baa17fdde&bb=3O82POBeUphUY5u-tecTQi_Go-lUbERhH_JPHKV7vyKxtrahIRFxqFB4lqIVxyMb0TUFP-PAzT_coCXy5dbpA-T1oJG3B_KA75uefr4NC9RvkPlV73L4kAmzi_QusAWSx7cAvX6Zwu_7o3Yq9TlvZA%3D%3D&xkcb=SoBm67M3uH6hX_XzUR0GbzkdCdPP&fccid=beaaaf311e6a010d&cmp=Aletheia-Digital&ti=Software+Engineer&vjs=3"
"","","","","The Work The Software Engineer is responsible for the design, development, testing, and management of application development projects in support of IT infrastructure. This includes programmatic integration of third-party components, introduction of new custom capabilities, modification of existing code, process improvement recommendations, and automation of operations and maintenance tasks. The Software Engineer develops and implements technical efforts to design, build, and deploy applications under the direction of lead architects, including large-scale data processing, computationally intensive statistical modeling, and advanced analytics. This role participates in all aspects of the software development life cycle for all solutions, including planning, requirements, development, testing, and quality assurance.  This position performs all duties and responsibilities in accordance with the Mission, Vision, and Core Values of Cayuse.  Key Responsibilities Design, develop, test, and manage application development projects in support of IT infrastructure. Integrate third-party components programmatically and introduce new custom capabilities. Modify existing code to enhance functionality and performance. Recommend process improvements and automate operations and maintenance tasks. Develop and implement technical efforts to design, build, and deploy applications under the direction of lead architects. Work on large-scale data processing, computationally intensive statistical modeling, and advanced analytics. Participate in all aspects of the software development life cycle, including planning, requirements, development, testing, and quality assurance. Conduct technical project milestone reviews, code architecture sessions, resource estimation, and development best practices knowledge transfer. Other duties as assigned.  Qualifications – Here’s What You Need Bachelor’s Degree Minimum of 3 years of experience. Proven experience in software development and application management. Strong knowledge of application design, development, testing, and management. Experience with programmatic integration of third-party components. Proficiency in modifying existing code and introducing new custom capabilities. Ability to recommend and implement process improvements and automation. Experience with Microsoft 365 Power Platform and SharePoint. Experience with large-scale data processing, statistical modeling, and advanced analytics. Strong understanding of the software development life cycle, including planning, requirements, development, testing, and quality assurance. Experience working under the direction of lead architects. Familiarity with technical project milestone reviews and code architecture sessions. Knowledge of resource estimation and development best practices. Ability to transfer knowledge and mentor team members. Active Top Secret with SCI eligibility Must be able to pass a background check. May require additional background checks as required by projects and/or clients at any time during employment. Minimum Skills Required: Excellent problem-solving and analytical skills. Strong communication and interpersonal skills. Ability to respond effectively to customers with a sense of urgency. Proficient in Microsoft and Adobe toolsets, including Excel, Word, PowerPoint, Acrobat, etc. Highly motivated with the ability to handle and manage multiple tasks at any one time. Ability to forge new relationships, individual and teaming in nature. Must be a Self-starter, that can work independently and as part of a team.  Our Commitment to you / overview of benefits Medical, Dental and Vision Insurance; Wellness Program Flexible Spending Accounts (Healthcare, Dependent Care, Commuter) Short-Term and Long-Term Disability options Basic Life and AD&D Insurance (Company Provided) Voluntary Life and AD&D options 401(k) Retirement Savings Plan with matching after one year Paid Time Off  Reports to: Program Manager  Working Conditions Professional office environment. Ability to work, M-F, between core hours of 6:00 AM and 6:00 PM ET. Must be physically and mentally able to perform duties extended periods of time. Ability to use a computer and other office productivity tools with sufficient speed to meet the demands of this position. Must be able to establish a productive and professional workspace. Must be able to sit for long periods of time looking at computer screen. May be asked to work a flexible schedule which may include holidays. May be asked to travel for business or professional development purposes. May be asked to work hours outside of normal business hours.  Other Duties: Please note this job description is not designed to cover or contain a comprehensive list of activities, duties or responsibilities that are required of the employee for this job. Duties, responsibilities, and activities may change at any time with or without notice.  Cayuse is an Equal Opportunity Employer. All employment decisions are based on merit, qualifications, skills, and abilities. All qualified applicants will receive consideration for employment in accordance with any applicable federal, state, or local law.","https://www.indeed.com/rc/clk?jk=1e739142a580603d&bb=3O82POBeUphUY5u-tecTQtTNwz3ZxSAzimSrAZiYBZXv721mYh7ynMyOSZA-XCiuyUhzsTziF6Nf9IKRdNUy5EMQL-uZIuS1jwOoPwSqx7HltGFQCPSjojAgc5Qy6lsEDKbtskN0F1zqQvdT8qzQMQ%3D%3D&xkcb=SoD767M3uH6hX_XzUR0FbzkdCdPP&fccid=409827641b0598e0&vjs=3"
