"Title","Company","Location","Salary","Summary","Link"
"","","","","About Nudge Nudge’s goal is to help the brain work better by creating a generalized product that can precisely stimulate and image the brain, entirely non-invasively. We aim to achieve this by developing cutting-edge ultrasound technology to treat neurological and psychiatric disorders, like addiction, and eventually, creating a mainstream consumer device that can modulate mood, focus, sleep, and more. To realize those ambitions, we’re growing a scrappy, multidisciplinary, science and engineering team focused on making the best technology possible for interfacing with the whole brain, and a product that has the potential to improve people’s daily lives more than any other. About the team The engineering team at Nudge works at the intersection of neuroscience, software, machine learning, firmware, electrical engineering, mechanical engineering, and acoustics. Our team includes engineers who have led development of the surgical robot at Neuralink, built augmented-reality hardware at Apple, and designed parts on SpaceX Starlink satellites. We are scrappy, hands-on, and welcome exceptional individuals who are passionate about their craft and energized by working on impactful, technical challenges. About the role We’re hiring software engineers who can own significant parts of our software stack and impact a wide range of verticals. You’ll work on software that interacts with every part of Nudge and our product, from device-specific software to simulation, infrastructure, and patient-facing portals. About you 3+ years of experience You love and obsess about software You enjoy shipping things that people use You enjoy helping other teams and people move faster Compensation Range $140,000 - $280,000/year + equity While this represents our expected range based on market data, final compensation will be determined based on your specific qualifications and may be outside this range.","https://www.indeed.com/rc/clk?jk=9172fb696cec4ac7&bb=UVWez1k2JDZc49gaGQ5N_0qUlBdPCltxOtOEq5lV5dirbBWnStxtgXqimi_o69OPPNYdnCiItzqJwpplLdfJ7JZoDRwNU-iCd1CrY3iY7NICpz6981YOZusM4600fUS0fxBfFE0Z7LCGcVQxO6CE0w%3D%3D&xkcb=SoDE67M3uH6n8AXqc50DbzkdCdPP&fccid=21cf331e036aba44&vjs=3"
"","","","","Desired Candidate Qualities: •  Self-motivated and willing to learn  •  Team-oriented individual with strong problem-solving abilities  Skills: •  Working knowledge of high-order programming languages and Web-based programming  •  Object-Oriented Design/Development  •  Experience in debugging software  •  Experience in verification testing of software  •  Technical writing skills: capable of creating required engineering documentation  Education: •  Bachelor's degree in an Engineering or Scientific field  Requirements and Expectations: •  US Citizenship and ability to obtain a Secret Clearance  Benefits: Tech Wizards is an employee-oriented company offering: Relocation Assistance Exceptional salaries Company funded retirement plans Major medical, dental, and vision insurance for employees and their dependents Competitive vacation, holiday, and sick leave packages Life insurance and short/long term disability insurance Educational assistance programs Flexible work schedules Tech Wizards, Inc. is an equal opportunity employer. All qualified applicants will receive consideration for employment without regard to race, color, religion, sex, sexual orientation, gender identity, ethnic or national origin, ancestry, pregnancy (including childbirth or related condition), citizenship, familial status, mental or physical disability, veteran status, genetic information, other non-disqualifying disability, or any other characteristic protected by law.","https://www.indeed.com/rc/clk?jk=e01aacd0c2612d84&bb=UVWez1k2JDZc49gaGQ5N_w2sRm0e4ydKVmAib3QGJNfVVEUBxwy34z39e6UH7OX80zRmSQOKaTDdHlCSRWdkI2_sFBLfbro5vp1gPkgwUVazGjTf9afbAvD2oFiAQz9qQXn-DigmCJliYS1i4Cwa9g%3D%3D&xkcb=SoBw67M3uH6n8AXqc50CbzkdCdPP&fccid=82770715e1734ea6&vjs=3"
"","","","","Experience: 3+ Years, (Post: 2) Sr Software Developer North Attleborough, MA  Nextbits Inc is recruiting Software Developer to join our fast growing development team. We are looking for dynamic individuals who want to be part of a successful young team with an enviable track record in web technologies. The successful applicants will have the opportunity to make a significant contribution to our continued growth, and to influence the future direction of our web technologies projects. Candidate must be proficient with HTML, CSS, JavaScript, PHP. Should be able to work in a team, able to analyze client requirement and develop a development approach and testing approach and coordinate with team members to achieve business needs.Education: Bachelor degree in Computer Science or Computer Engineering or Computer Information Systems or Software Engineering or a similar degree.","https://www.indeed.com/rc/clk?jk=3cdeacd3e86d75a1&bb=UVWez1k2JDZc49gaGQ5N_02anfEh4vqWCV1XyCIlImt1BzpUutIyRoqTixQGJu8-ARU9elGV7vyDKyyR1fshx7ekmUtW1-SOioh52fHz18HHAEU528ckkGQbiKxUrnD2XZbOK1LsdqQ_wOnZZUV_Uw%3D%3D&xkcb=SoDt67M3uH6n8AXqc50BbzkdCdPP&fccid=7a3288963c5553b8&vjs=3"
"","","","","Company Description  AG Technologies was founded as a software solutions company in 2008 & has its corporate headquarters at Chesterfield, Missouri with branches within the US and India. Over the years the organization has expanded into various market segments & activities including 'Consultancy services' of technical personnel in large and multi-national organizations. Over the last five years, our client base of Fortune 100 companies has expanded dramatically  Job Description  Skills :C++,SQL,Oracle  Qualifications  Master of Computer Science /MIS/ECE/EE  Additional Information  Further Information please contact to 214-295-4212","https://www.indeed.com/rc/clk?jk=8b9d413afb9435c0&bb=UVWez1k2JDZc49gaGQ5N_yPtBOGOgzUTmfcZuvcNtgquUzj7QiO6eGyDRzXocAgO21U05uIufDHXtDLDl_iuc9R2EoytxNEWOr656KWOZ3-Yd1UwLCc8r85z0HhF2UG28ZOljBtAQ_g-pvuIeXcXtw%3D%3D&xkcb=SoBZ67M3uH6n8AXqc50AbzkdCdPP&fccid=3d8f40897a299d79&vjs=3"
"","","","","Seeking candidate with Master’s degree in Computer Science, Engineering, IT or related field and two (2) years software development experience required. Alternatively, would accept a Bachelor’s degree in Computer Science, Engineering, IT or related field and (5) five years software development experience required. Travel and relocation, as required.  Mail CV to Attn: HR/Job #0216, Taproot Solutions, Inc., 317 Ranch Road 620 South, Ste 302F, Austin, TX 78734  Please send your resumes to info@taproot-solutions.com","https://www.indeed.com/rc/clk?jk=e036f7605e82376e&bb=UVWez1k2JDZc49gaGQ5N_94juIDmXRYPBtXyjHgCTVwXn6KWeA32fHgvL-vFe4h2Wnm1wmcwB_Bx4eL7Hzu2KDOzQ5CPJpVYjXHIFcsLTdoK7_fxS4GXOrLHdL5D6ror45Iy433XRQj2pxZpBOzJ6Q%3D%3D&xkcb=SoDX67M3uH6n8AXqc50HbzkdCdPP&fccid=fddca8c3afd8807f&vjs=3"
"","","","","Job Details Description Sunrise Futures is looking to hire a highly talented Software Developer to join our technology team. The Role: Working collaboratively with the technology and business teams on our trading and research platforms Designing and implementing high-quality software solutions used for algorithmic trading, exchange connectivity, and research Exploring and working with industry-leading software and hardware Learning from industry experts in the fields of technology and finance Working on challenging and dynamic problems in a team atmosphere The Requirements: Bachelor’s Degree in Computer Science or an equivalent field Programming skills and understanding of general programming concepts such as OOP and data structures C++ experience is a plus but not required Problem solvers who are driven, self-motivated, and 'outside of the box' thinkers Motivated, dependable, and responsible team players Excellent written and verbal communication skills The Company: At Sunrise Futures, we bring science to trading. We have built a perfect combination of an algorithmic trading engine, a scientific research laboratory, and a technology venture. We harness the combined power of our industry-leading research platform, cutting-edge technology, and highly talented team to produce algorithmic trading strategies in markets all around the globe. By putting a tremendous emphasis on scientific trading, we have had a growing profit stream ever since our inception. Sunrise Futures is a mix of computer scientists, physicists, engineers, and mathematicians – but in a nutshell – we are all problem solvers. At Sunrise we strive to maintain a highly collaborative and productive environment. By selecting only individuals who we truly believe are a good match for the firm and vice versa, we have built an exceptional team and workplace where everyone can thrive, learn and excel to their maximum potential. The Benefits: Paid time off and sick leave Fully covered medical and dental insurance premiums Generous 401(k) match Daily catered lunches plus fully stocked kitchens with snacks Free gym membership Flexible spending accounts RTA commuter plan Life insurance Short-term disability coverage Tuition reimbursement program Frequent company events, happy hours, and more!","https://www.indeed.com/rc/clk?jk=7da002b5119544dc&bb=UVWez1k2JDZc49gaGQ5N_5kqtmZS7fTBYV4qiGhyEKeCQwd5Mtpzsnxj37NQVvS0lzBnXH4ob7SVBZy-1pXDFtcuAGVIbMt4fjc_mRc6CROMxi34wzouLzAwytIy_Qr9jcrBysh2W_zvlK_7zgW7bA%3D%3D&xkcb=SoBj67M3uH6n8AXqc50GbzkdCdPP&fccid=8b433c2f94762984&vjs=3"
"","","","","Software Engineer At Aletheia Digital, we are guided by three core tenets: Make it Work For The Client, Provide Exceptional Customer Service, & Form Authentic Relationships. We are grounded in an “others first” mindset. That means we are driven to deliver results for our team members and clients; we serve others the way they want to be served; and we invest in building connections through relationship each and every day. We are deeply influenced by the entrepreneurial spirit. Our team members are problem solvers by nature, looking for solutions and new ideas rather than having those solutions and ideas given to them. We learn from each other, challenge each other, and celebrate each other when we succeed. As a Software Engineer with Aletheia Digital, you will embody this philosophy by continuing to develop and maintain software applications and partnering with your team members to ensure the work we do meets and exceeds expectations. As a Software Engineer, the key responsibilities you’ll engage in daily are: KEY RESPONSIBILITIES Developing new software applications on both the front and back ends Maintaining, optimizing, and improving current software applications System and Software documentation Other duties as assigned As a Software Engineer, the desired or required experience we are looking for are: EDUCATION / EXPERIENCE Bachelor's degree or equivalent in Computer Science or related fields 3 years of Software Engineer experience preferred Coding Languages: JavaScript, HTML, CSS, and others Platforms: Google Cloud Platform, Amazon Web Services Lightsail / EC2, Duda, Supabase, GitHub Skills: APIs, Webhooks, UX and UI, Software Packages Exceptional people skills with a positive and cheerful disposition Must be extremely resourceful and able to make sound recommendations based on research and experience Must be a self-starter who sets priorities, approaches new tasks with positivity and strives to execute with a high level of self-confidence, accountability, poise, maturity and interpersonal skills Must be able to manage the demands of completing multiple tasks under deadline Must be a team player who is passionate about their contribution towards delivering great work At Aletheia Digital, we know our first customer is YOU! That is why we provide benefits that go beyond your paycheck. Creating a work environment that helps you maximize your potential is our commitment to our team members. To that end, as a Software Engineer with Aletheia Digital, you can expect the following additional benefits with your employment: BENEFITS Health Insurance Dental Insurance Vision Insurance Paid Time Off 401(k) Life Insurance Disability Insurance Job Type: Full-time Benefits: 401(k) Dental insurance Health insurance Life insurance Paid time off Vision insurance Schedule: 8 hour shift Monday to Friday Work Location: In person Columbus, GA Job Type: Full-time Pay: $80,000.00 - $100,000.00 per year Benefits: 401(k) AD&D insurance Dental insurance Disability insurance Health insurance Life insurance Paid holidays Paid time off Vision insurance Schedule: 8 hour shift Monday to Friday Work Location: In person","https://www.indeed.com/rc/clk?jk=340c549baa17fdde&bb=UVWez1k2JDZc49gaGQ5N_5roJvdeY1vMh0JvbKMljuOUweVaoEx65Dx65Zdv85EqokUteKQEwoPJHMYHFFoxRO9HUwkHebsjEac-HFJRzkoeHloSmmVMDMqyJsg0tDDuqnnrI55fwjXCbcWoL3Q3Jg%3D%3D&xkcb=SoD-67M3uH6n8AXqc50FbzkdCdPP&fccid=beaaaf311e6a010d&cmp=Aletheia-Digital&ti=Software+Engineer&vjs=3"
"","","","","Job Details Description Sunrise Futures is looking to hire a highly talented Software Developer to join our technology team. The Role: Working collaboratively with the technology and business teams on our trading and research platforms Designing and implementing high-quality software solutions used for algorithmic trading, exchange connectivity, and research Exploring and working with industry-leading software and hardware Learning from industry experts in the fields of technology and finance Working on challenging and dynamic problems in a team atmosphere The Requirements: Bachelor’s Degree in Computer Science or an equivalent field Programming skills and understanding of general programming concepts such as OOP and data structures C++ experience is a plus but not required Problem solvers who are driven, self-motivated, and 'outside of the box' thinkers Motivated, dependable, and responsible team players Excellent written and verbal communication skills The Company: At Sunrise Futures, we bring science to trading. We have built a perfect combination of an algorithmic trading engine, a scientific research laboratory, and a technology venture. We harness the combined power of our industry-leading research platform, cutting-edge technology, and highly talented team to produce algorithmic trading strategies in markets all around the globe. By putting a tremendous emphasis on scientific trading, we have had a growing profit stream ever since our inception. Sunrise Futures is a mix of computer scientists, physicists, engineers, and mathematicians – but in a nutshell – we are all problem solvers. At Sunrise we strive to maintain a highly collaborative and productive environment. By selecting only individuals who we truly believe are a good match for the firm and vice versa, we have built an exceptional team and workplace where everyone can thrive, learn and excel to their maximum potential. The Benefits: Paid time off and sick leave Fully covered medical and dental insurance premiums Generous 401(k) match Daily catered lunches plus fully stocked kitchens with snacks Free gym membership Flexible spending accounts RTA commuter plan Life insurance Short-term disability coverage Tuition reimbursement program Frequent company events, happy hours, and more!","https://www.indeed.com/rc/clk?jk=7da002b5119544dc&bb=3O82POBeUphUY5u-tecTQpjccfFy2VcteROzQw_gIfHyHon-Z9PGmR0Tjmn11Y82lkmQM_Xibp1U7e6BYWijSbAxTKOghYPFwMQodjkblOtn0dQoNWRmhDR-EaYLK3zJevhGMMiFWbyL_fWMD9KC_Q%3D%3D&xkcb=SoCm67M3uH6hX_XzUR0LbzkdCdPP&fccid=8b433c2f94762984&vjs=3"
"","","","","Founded in 2019 and headquartered in Pittsburgh, PA, Free Market Health supports forward-thinking payers and specialty pharmacies of all sizes who need to operate in a complex and opaque market. We empower all stakeholders to optimize resources and maximize opportunities while focusing on the most important stakeholder of all: the patient.  About the role As part of the Technology Services team at Free Market Health, the Software Engineer will be responsible for all aspects of application development. As part of a growing team in a fast-paced environment, we are looking for a Software Engineer that will contribute directly to key design and development decisions, who is focused on impeccable code, rigorous review, and who has an automation-first mindset. What you'll do  The specific responsibilities for this role include, but are not limited to:  Developing software for a new healthcare technology platform in a cloud-based microservices architecture Working with a small team to cross-functionally contribute to product design Creating scalable, automation-focused solutions Writing tests to ensure reliability and compatibility Adhering to modern secure coding standards inherent to working with sensitive healthcare data Developing front end interfaces focused on a clean, intuitive experience for end users. What we need from you Bachelor's Degree in IS, CS, Computer Engineering or similar Experience (academic or professional) developing software solutions in a modern application development environment One of the following is required: Demonstrable proficiency with Python and SQL Demonstrable proficiency with React Demonstrable code portfolio that is best practice-oriented Ability to work within a team and communicate effectively Nice to have: Healthcare technology experience Experience with both Python and JavaScript Experience in a cloud environment leveraging a container strategy","https://www.indeed.com/rc/clk?jk=e5f6c8d0ae243f06&bb=3O82POBeUphUY5u-tecTQgTqY0CgUTWuxUA9wilKja_pF-C6zZQOa8YUL8HnGDzfqN8NfiIXkD9zvRMGi73x4NxGq0R6vi2O5X-UVFr5-1d7uD17c4tEbBtrQWtCXE-KVcuHVPYtqqyIu5LEMFiEoA%3D%3D&xkcb=SoAS67M3uH6hX_XzUR0KbzkdCdPP&fccid=9bf88695f4681508&vjs=3"
"","","","","Think you have what it takes to be part of our Savvy squad? Open positions are listed below, please contact us at 866.303.2558 or email your resume to info@paymentsavvy.com. Our Management Team will be in touch to discuss position details and requirements.  SOFTWARE ENGINEER We are seeking a Software Engineer for a full-time position. An ideal candidate is someone with the ability to creatively push the limits of software engineering in new and exciting ways; thrives on learning, and can work alone and as part of a team. Strong attention to detail and excellent communication skills are highly desired.  Duties & Responsibilities Responsible for the programming of applications onto platforms as dictated by project needs Maintain a clean code base Work with supervisors and project leads to ensure timely milestone-based deliveries Collaborate with designers and project leads to ensure an amazing end user experience  Required Skills and Competencies Experience with custom payment gateway development BA/BS in Computer Science or equivalent MSSQL Experience Must have previous development experience Comprehensive understanding of Object Oriented programming languages Ability to work independently and in a team environment An eye for quality and design cleanliness in user interfaces Strong analytical skills, self-motivation, dedication, and discipline Desired Skills 3 years C#.Net Experience 3 years Python Experience Javascript and/or Unity Experience Experience developing applications or user interfaces for end users Experience in a diverse pool of programming technologies","https://www.indeed.com/rc/clk?jk=2cc1a952ce2874d7&bb=3O82POBeUphUY5u-tecTQrnsZIACjvo6hwFP_FuVFtwfu7iCZzTN1MUDY-I9ryGfLdhYj_zwVbcQF34g_-SGxMOSy_SOCuWdQvpb7WbnLfMI830EsB8z6KVn4fjTHyb3E7xfHN_-L6TzAeZesmyiMg%3D%3D&xkcb=SoCP67M3uH6hX_XzUR0JbzkdCdPP&fccid=1f5ea50aa04835b0&vjs=3"
"","","","","VIKTech is seeking a talented software development engineer to design and build customer facing cross-domain cloud services. The Cross Domain Services team provides solutions for customers to move data between AWS regions and accounts with differing security requirements.  As a Software Development Engineer on the Cross Domain Services team, you will:  Build new capabilities to help customers securely exchange data. Interact directly with AWS customers to understand how to best meet their needs. Directly contribute to designing and building cutting-edge distributed systems with visible impact on the efficiency and effectiveness of our customers. Be part of a world-class team in a fast-paced environment that has the entrepreneurial feel of a start-up. Be surrounded by people who are passionate about cloud computing and believe that world class service is critical to customer success. This position requires that the candidate selected be a US Citizen. The candidate selected must obtain and maintain a security clearance at the TS/SCI with polygraph level.  We are open to hiring candidates to work out of the following locations:  Columbia, MD, USA","https://www.indeed.com/rc/clk?jk=9fd8a3d99a626a9c&bb=3O82POBeUphUY5u-tecTQo48WcMkTTnxZStV6BBp4dM3JgtcMA22gSyVVN92eHjA9kdvPwAES-DfxdMYpHbjWIZ2AvfdraLIFe2vdcMyFymI5b3yUM-K8nYK2wV4GIQqgd63n9PiEENCue4t6wzvbg%3D%3D&xkcb=SoA767M3uH6hX_XzUR0IbzkdCdPP&fccid=e752d81fbc4f0ea0&vjs=3"
"","","","","Location: San Jose - Department: Engineering Responsibilities: Front and Back End (Full Stack) Development Fixing bugs, maintaining third party modules Coding and development of new CMS pages and/or Microsites API integrations and programmatic integrations Creating project related documentation Tracking the issues in a development cycle tracking system. Responsible for documenting and resolving program issues (bugs) and ensuring","https://www.indeed.com/rc/clk?jk=03616222f7fd152f&bb=3O82POBeUphUY5u-tecTQo_gqiwUwIWNMevmbZDzXSbmT1paqW769NXziGaVT7MO7CNM8HjbKbGnN-LB6RcBrNZQ4Y-Mq-P_3q52q-fpxb6P82u2VVCqTtJK31zp5Uwu8BGO9-C9_Bmo2sTgt8mupQ%3D%3D&xkcb=SoC167M3uH6hX_XzUR0PbzkdCdPP&fccid=1c61bef13fd67eea&vjs=3"
"","","","","Software Engineer  Job Description: Entry level position. Design and develop computer programs to solve various scientific and engineering problems. The problems are usually related to device control, machine vision, or data organization. Successful candidate will take (often under-specified) problem descriptions, figure out how to solve the problems, and create computer programs to implement the solutions, communicating with other team members as needed. This will often require knowledge of the theoretical foundations of computer science, including computer system and system software organization, the theoretical models for the representation and transformation of information structures, and knowledge of relevant mathematical and statistical sciences. At this level employee often refers problems not covered by instructions or guides to the supervisor or senior level for help or a decision. Required Education: Related Bachelor Degree or Equivalent Training Required Skills: Must have working knowledge of C++ or Java. Linux operation and knowledge of command-line based software development tools (such as subversion, make, gcc, vi, etc.). Communicate effectively with supervisor and team-mates. Additional preferred skills: STEM familiarity: basic physics (mechanics), basic electrical circuits (Ohm's law), comfortable working with linear algebra, statistics, trigonometry and calculus concepts. Library familiarity: OpenCV, OpenGL, Swing, JavaFX, boost, .NET, *nix system calls Additional tools: TensorFlow, Python, MATLAB, Microsoft Office, Visual Studio. Required Experience: At minimum 2 years of related experience required. Additional preferred experience: Any work experience writing computer programs, websites, or solving technical problems is a plus. Experience solving data science challenges, such as Kaggle, is a strong plus. Additional Requirements: This job requires you to be either a US Citizen or a US Permanent Resident, due to State Department Regulations regarding ITAR related programs. Job Location Ann Arbor, United States  Position Type Engineer","https://www.indeed.com/rc/clk?jk=72469d3a0b251314&bb=3O82POBeUphUY5u-tecTQkD0kM2oMIBOLeUcWwiYuFpuP-eabqprtnlJLjBRy_6eS4yZr0FoZR7GF8D7xbT6Y_jujoBfn_haK2yZG_VLmESMR2GdNsSG39zC5miBwUpm0mPSC6NhGLRShoqc-i5Nhg%3D%3D&xkcb=SoAB67M3uH6hX_XzUR0ObzkdCdPP&fccid=1ccf8419327ca5d0&vjs=3"
